Title,Company,Location,JD,URL
Mechanical Engineer - AR/VR Accessories,Facebook,"Menlo Park, CA","skills:  
Collaborate with cross-functional teams including Industrial Design, Hardware Engineering and Product teams to create functional prototypes based on concepts in the accessories roadmap and deliver final products to mass production. 
Identify components, materials, and manufacturing process that achieve a high quality product within cost targets at high volume. 
Create mechanical architecture and detailed 3D models according to established specifications. 
Leverage internal resources and drive overseas partners (ODM/JDM/CM) to expand the capabilities of our team and deliver on projects. 
Apply engineering and tolerance techniques to high precision design requirements in the areas such as optics, electro-mechanicals, and battery/power systems. 
Establish and refine product design process, best practices, and/or tools for the organization. 
Lead cross-functional design reviews and engineering discussions. 
Bachelors in Mechanical Engineering or equivalent work experience. 
7+ years of experience in a hands-on Engineering/Design role with experience in high volume consumer electronics and product development. 
A history of full mechanical system ownership in at least two shipping products. 
Experience working with China-based vendors remotely and in-person, including a variety of engineering engagement models (CM, JDM and ODM). 
Problem solving skills and experience working independently as well as part of a multidisciplinary team. 
Manufacturing knowledge and experience (Design for assembly, DFM with injection molding, die-cast, machining, sheet metals, die-cuts etc.). 
Knowledge of designing electrical sub-systems (PCBs, FPCs, interconnects, batteries, etc.). 
Experience with system level design and working with cross-functional teams including Engineering, Product Design, Research, etc. 
3D CAD design experience and working with complex ID surfaces. 
Understanding of GD&T and tolerance analysis methods. 
Experience of building part and assembly prototypes in a prototype shop environment. 
10+ years of product design/prototyping and R&D experience, including full systems ownership. 
Mandarin language skills. 
NX/Teamcenter CAD system knowledge. 
Knowledge of statistical problem solving approach. 
Design Analysis experience (FEA Structural Simulations). 
Experience with wearables and soft-goods design. 
Experience with designing handheld or wearable electronics for high volume manufacturing. 
Knowledge for AR/VR and video conferencing technologies. Hiring Lab Career Advice Browse Jobs Browse Companies Salaries Find Certifications Employer Events Work at Indeed Countries About Help Center Do Not Sell My Personal Information Privacy Center",https://www.indeed.com//rc/clk?jk=d6dc87d14a812bc5&fccid=1639254ea84748b5&vjs=3
"Accounting Manager, AR/VR",Facebook,"Menlo Park, CA","skills:  
Partner with Finance, Operations and Business Development teams to understand business models, and provide accounting support for all existing contracts and new deals on a forward-looking basis. 
Review contracts to ensure compliance with GAAP and internal policies. 
Document technical accounting positions on significant multiple element business arrangements. 
Assist in development of accounting policies and operations for new accounting initiatives and business processes. 
Assist with month-end close procedures including preparation of journal entries, reconciliations, and other duties as necessary. 
Fulfill internal and external audit requests. 
Assist with the preparation of quarterly reporting packages to management. 
Bachelor degree in Accounting, Finance or related discipline 
8+ years of experience in accounting or finance 
Knowledge of U.S. GAAP and Internal Controls 
Experience implementing and improving business processes and systems 
Highly collaborative temperament, proven communication skills and demonstrated experience working in a fast-paced environment 
Self-starter with attention to detail yet possesses an understanding of the ""big picture”. Experience operating with a high degree of autonomy 
Experience partnering with Operations Business Partners and Financial Planning teams is preferred Hiring Lab Career Advice Browse Jobs Browse Companies Salaries Find Certifications Employer Events Work at Indeed Countries About Help Center Do Not Sell My Personal Information Privacy Center",https://www.indeed.com//rc/clk?jk=3cc3c704b8378ec1&fccid=1639254ea84748b5&vjs=3
"Global Supply Manager, Silicon (Facebook AR/VR)",Facebook,"Menlo Park, CA","skills:  
Develop overall vision, strategy and execution plan for the Global Semiconductor/Electronics Sourcing function. Driving an integrated long-term supplier development approach focused on delivering world class quality, delivery and cost. 
Negotiate and execute master supply contracts and other critical agreements including but not limited to licensing agreements, SOWs, etc. 
Establish, manage and own strategic supplier relationships at the supplier executive level. 
Subject matter expert in commodity cost profiles and should cost models. 
Develop, manage and refresh individual and customized Semiconductor technology, Architecture and commodity sourcing strategies for each actively managed technology. 
Lead Supplier QBR process focused on exceeding Facebook KPI’s and continuous performance improvement. 
Influence supplier technology roadmaps and create internal disruptive value-add to ensure Facebook’s system architecture and commercial requirements are met. 
Continually benchmark the industry to monitor technology trends and ensure best practices are incorporated into the Facebook AR/VR supply chain. 
Drive Early Supplier Involvement initiatives to ensure our commodity suppliers are proactively providing input into new product designs and future product roadmaps. 
Establish supplier selection criteria, evaluate alternative suppliers, manage RFQ process, and drive final supplier selection in partnership with Hardware Engineering and Supply Base Engineering. 
Initiate and lead ongoing Cost Reduction programs to ensure the lowest possible total cost, including product cost, transportation cost, inventory cost, and cost of quality. 
Formulate contingency plans to de-risk technical challenges, long lead time, single source, and any supply issue. 
Institute programs to optimize schedule flexibility while minimizing excess inventory exposure. 
Work with Supply Base Engineering and our CM partners to avoid any potential part shortages or quality problems which are affecting production schedules. 
Bachelor’s Degree in Supply Chain, Business, or related field. 
10+ years work experience in Procurement or related disciplines specific to electrical including strategic silicon and board electrical sourcing. 
Experience in supplier evaluation/selection, should cost models, contract negotiation and supply base management. 
Leadership, program management and cross-functional teamwork experience. 
Experience with communicating and to influence all levels of management. 
Experience with high volume, consumer electronics products. 
10+ years experience managing global Silicon commodities. 
Experience operating in dynamic, fast-paced environment with minimal supervision. Hiring Lab Career Advice Browse Jobs Browse Companies Salaries Find Certifications Employer Events Work at Indeed Countries About Help Center Do Not Sell My Personal Information Privacy Center",https://www.indeed.com//rc/clk?jk=9f5b25962bcbc955&fccid=1639254ea84748b5&vjs=3
"Partner Engineer, AR/VR",Facebook,"Menlo Park, CA","skills:  
Help partners integrate their apps/services on to Facebook’s family of AR/VR devices. 
Work closely with partner technical teams to identify issues with their apps and recommend possible solutions. 
Develop a deep understanding of the various AR/VR devices/platforms and underlying implementations used for shipping apps and services. 
Identify and highlight missing functionality in our features, API’s or services and work closely with product and engineering teams to prioritize and build it. 
Be a subject matter technical expert, and have strategic influence on external partners and internal teams at Facebook. 
Work closely with internal teams at Facebook to ensure the right features are built to address partner needs. 
Ensure great documentation and best practices are created to collaborate with partners. 
Willingness to travel 5% of the time. 
4+ years of relevant industry experience - software engineering, partner/sales engineering. 
Experience with Android development and using various SDKs and libraries. 
Experience integrating with any device level services such as assistants, SDKs, casting etc. 
Software development experience in languages and environments such as Java, NDK(C++) and/or PHP. 
Experience working with Android operating system. 
Experience communicating and interfacing with external partners. 
BA/BS in Computer Science or equivalent degree/experience. 
Experience building and shipping apps on multiple android platforms (Google Play, Amazon etc.) and form factors (mobile, tablet, tv etc.). 
Experience working on Android Open Source Platform (AOSP). Hiring Lab Career Advice Browse Jobs Browse Companies Salaries Find Certifications Employer Events Work at Indeed Countries About Help Center Do Not Sell My Personal Information Privacy Center",https://www.indeed.com//rc/clk?jk=038e81940ca414ec&fccid=1639254ea84748b5&vjs=3
Horizon TPM Lead - Facebook AR/VR Experiences,Facebook,"Menlo Park, CA","skills:  
Lead technical program management for projects that break new ground and define categories and are consistent with Facebook’s mission. 
Day-to-day decision-making and leadership for AR/VR Social Experiences Management including internal teams and external partnerships. 
Work cross-functionally with partner technology and business teams to get software products developed and shipped on time and within budget. 
Collaborate with AR/VR Experiences leadership team to define future products and product enhancements. 
3+ years of management experience. 
5+ years experience in managing complex ambiguous software products with a variety of stakeholders. 
Experience shipping a software product built in Unity and/or similar game engines from pre-production through to live. 
Experience leading multiple teams & managing multiple projects concurrently. 
Experience with the product development process, tools and systems. 
Organizational communication, coordination and multi-tasking experience. 
Experience with managing third-party vendors. 
Experience with VR technology and connecting the world in a meaningful way. Hiring Lab Career Advice Browse Jobs Browse Companies Salaries Find Certifications Employer Events Work at Indeed Countries About Help Center Do Not Sell My Personal Information Privacy Center",https://www.indeed.com//rc/clk?jk=d1c5c95daf62a972&fccid=1639254ea84748b5&vjs=3
"Display Research and Development Engineer, AR/VR",Google,"Mountain View, CA","skills:  
Ph.D. degree in a Display related field or equivalent practical experience. 2+ years of work experience in display and R&D Environment
 
Knowledge and experience of Micro-LED architecture, epitaxy material, epitaxy growth equipment (MBE/MOCVD) and process. Knowledge of major design, test and manufacturing challenges for micro-LED displays. Knowledge of micro-display (LCoS, DLP, micro-OLED, micro-LED, etc) technology, familiar with display and backplane design, and fabrication process. Knowledge of all display technologies. Established relationships with micro-display suppliers, and equipment and material vendors. Excellent communication and analytical skills. Innovate, develop, and integrate leading edge micro-LED display technologies for VR/AR. Demonstrate deep understanding of relationship between display technologies and its business goals. Work closely with cross-functional teams (e.g. Electrical, Organizational/Mechanical, Software Engineering, Display, UX) to define requirements and specifications of an advanced display to optimize the visual system. Guide and work with display partners, and even material/component/equipment supply chain partners to solve the key challenges during display development phase. Evaluate and test the key display image, efficiency, power, and reliability performance. Hiring Lab Career Advice Browse Jobs Browse Companies Salaries Find Certifications Employer Events Work at Indeed Countries About Help Center Do Not Sell My Personal Information Privacy Center",https://www.indeed.com//rc/clk?jk=2bfe64d12a97b67a&fccid=a5b4499d9e91a5c6&vjs=3
"Display Programmatic, Performance Marketing Manager: AR/VR",Facebook,"Menlo Park, CA","skills:  
Manage Display and Online Video campaigns, channel strategy and launch large scale, breakthrough campaigns for Portal/Oculus 
Build industry leading optimization capability to maximize hardware sales at efficient ROAS 
Implement channel best practices, identify optimization opportunities using data, and architect ambitious test plans across targeting, creative/ad copy, platform, publishers, landing page, keywords etc. 
Build in-house strategic and operational capabilities, manage performance agency, vendors where needed 
Determine KPIs, establish reporting, manage and own channel performance 
Provide thought leadership on attribution and channel incrementality for your channel 
Manage large marketing budgets and ensure we are allocating spend optimally across channels and marketing funnel 
Work cross-functionally with marketing stakeholders including: PMM, integrated marketing, decision science, creative, owned channel, brand 
5+ years of marketing industry experience, with a focus towards digital display advertising, online video ads 
Experience as a DR marketer with technical knowledge in demand side platforms, online video platforms 
Proven experience running in-house marketing strategy, campaign execution and operations (including experience with bid models, and audience segmentation targeting tactics) 
Analytical experience to conduct analysis on channel performance, identify optimization opportunities and use data to inform business decisions 
Knowledge in Excel 
Communication experience 
Experience managing contractors and vendor relationships 
BA/BS degree 
Experience with demand side platforms: The Trade Desk, Amazon 
Experience using DCM tracking solutions 
Experience working with large budgets (7 figures) 
Knowledge about consumer tech products 
Experience launching campaigns in international markets (in addition to US) 
Experience with marketing consumer electronics products and/or gaming 
4+ years experience marketing B2C products for retail/ecommerce businesses in the consumer electronics category Hiring Lab Career Advice Browse Jobs Browse Companies Salaries Find Certifications Employer Events Work at Indeed Countries About Help Center Do Not Sell My Personal Information Privacy Center",https://www.indeed.com//rc/clk?jk=3aaae4d203de95fe&fccid=1639254ea84748b5&vjs=3
Graphics Engineer AR/VR,Facebook,"Menlo Park, CA","skills:  
Develop innovative graphics techniques, algorithms, and tools to maximize graphics quality and performance 
Collaborate with Product Designers, Product Managers, Software Engineers and animation artists, to deliver the best Graphics solutions 
Document and support graphics features 
Write high-quality, performant, and maintainable code 
Improve current custom multi-platform engine 
Collaborate with cross-functional engineering teams to deliver innovation into AR/VR products 
3+ years of object-oriented and component based design experience. 
3+ years of experience with C/C++ programming. 
Bachelor's degree or equivalent experience in Computer Science or similar field. 
Knowledge of image processing and computer vision techniques. 
Knowledge of ray tracing, rasterization and linear algebra. 
Virtual reality experience (Rift, Vive, Go, Gear VR, etc.), AR or MR. 
Experience implementing advanced 3D graphics features such as lighting, effects, shaders and other low-level systems. 
Experience delivering AAA Games. 
Experience with mobile CPU/GPU programming. 
Experience developing or modifying camera pipeline on mobile platform. 
Experience with tools such as Maya, Houdini, Blender, 3Ds Max, Arnold, RenderMan, or Cycles. Hiring Lab Career Advice Browse Jobs Browse Companies Salaries Find Certifications Employer Events Work at Indeed Countries About Help Center Do Not Sell My Personal Information Privacy Center",https://www.indeed.com//rc/clk?jk=4d8876b7c7a60d41&fccid=1639254ea84748b5&vjs=3
AR/VR Business Analyst,Tailored Management,"Menlo Park, CA","skills:  Consolidate third-party retailer sales reports and upload reports to Hive Metastore. Use SQL to query sales related data on a distributed system. Create reports and dashboards to support sales leadership in making effective, analytically driven, and strategic decisions. Explore new data sources to add signal to existing models and develop models for new sales opportunities. Perform ad-hoc and in-depth analyses and then reporting/presenting insights. Partner with regional heads of sales to develop regional sales strategy. 2+ years of experience in business reporting, business intelligence or sales analytics. Reporting experience in a consumer electronics environment or retail industry preferred. Experience in querying and manipulating raw datasets for analysis using SQL (Presto, Spark, Hive). Experience in data ETL preferred. Experience in visualization, dashboards and reporting using Tableau, or other BI tools. Ability to partner with cross functional teams, prioritize tasks and move fast on projects. Experience in communicating findings to both technical and non-technical audiences. BS/MS degree in a quantitative discipline: statistics, applied mathematics, business analytics, computer science, engineering, economics, etc. Bachelor's (Required) United States (Required) One location Health insurance Dental insurance Vision insurance Monday to Friday Day shift 8 hour shift Hiring Lab Career Advice Browse Jobs Browse Companies Salaries Find Certifications Employer Events Work at Indeed Countries About Help Center Do Not Sell My Personal Information Privacy Center",https://www.indeed.com//pagead/clk?mo=r&ad=-6NYlbfkN0DI_pqscLjs9LkB0jlO39g2s8RE9SCHTdataN4HV1TulGfWI13h5d2IIBkrMCBpdyoKFuk6LoRw93nv9VIf-nwycaiTnbsKlxaYmP2oUVCrEos5MOIWzflKyJqtBexCiKWVxNVq0D9Lo3YRyX8n959AonagBpNTwfxL-PurTe6VIuRucl5-GiO9fNuGCgkJnI2iqwkhN0yI-9HDPmDpLo8lDG0Yauo0UUAhLnhMthNX_lng0YziqFNV47sBGr_3Zu60efQ_VVRdnyR9bovbX6ioXigaPOlQMh3VONRtTqo4Hp6HIKVk7vU8u-lN9W_AXs_zxJFtI9O52WiZmlw0dXRWofdiv5n13oh1qkaTqTicsGk-UfPCOd_6a9ZKaBjC-ABGtdqCL_-CHQTFm9eojMjrmM5JpQlCkhvAhoHuke9pKlyuFqdDDHQt9s0-fTCUzaZRYn-b6YdNShVX67EmTyCj&p=14&fvj=1&vjs=3
"Producer, Augmented Reality (Menlo Park)",The Mom Project,"Menlo Park, CA","skills:  Work closely with creative leads to set strategy and goals for creative development efforts Establish and maintain project production schedules to ensure a smooth end-to-end development plan that meets product goals and quality bar, and ensures that all assets are delivered on time and implemented to spec Establish and maintain an efficient and flexible project process that facilitates the creation, review, feedback, revision, deployment cycle of art asset production Strategically source and manage resources to keep project on-track As a point of contact for team communication, establish clear communication channels and process across creative and cross-functional teams, including Product Marketing Managers, Product Development, Engineering, QA, Legal and Policy Schedule, manage and address cross-functional feedback and stakeholder approvals Predict and/or identify roadblocks and obstacles, and proactively establish meetings or integration points between teams to address and resolve them Serve as team lead to align and anchor resources in a fast-paced environment Work closely with cross-functional product and engineering teams to unlock future possibilities that marry emerging technologies and creative expression Facilitate, document and disseminate decisions to key stakeholders Experience working with artists, designers and engineers to design, build, and deliver products and effects that use emerging technologies Experience in AR/VR/MR or 3D production highly desired Experience articulating design direction to artists and non-artists alike Experience working with external vendors (individual artists and agencies) including sourcing and contracting, advising on/defining schedules, assessing proposed production processes, managing assets as they are delivered, and being the daily point of contact for the internal team Experience in project management and relationship building Experience establishing and managing ongoing production Ability to thrive managing a globally distributed team Knowledge with Maya, Adobe Photoshop, Illustrator and other design packages Health Benefits: Medical, Dental, Vision, Life (including spouse & child), 401k, STD/LTD, AD&D, and Commuter Benefits program) Accrued PTO: Up to 15 days per 12 months on assignment New Child Benefit: Up to $4,000 for the birth or adoption of a child while on assignment (conditions apply) Health insurance Dental insurance Vision insurance Monday to Friday Hiring Lab Career Advice Browse Jobs Browse Companies Salaries Find Certifications Employer Events Work at Indeed Countries About Help Center Do Not Sell My Personal Information Privacy Center",https://www.indeed.com//pagead/clk?mo=r&ad=-6NYlbfkN0BDp_epf89aHDQhKpPegNJQ_ldQpEFZQsM9OcONMGxWx1gfak1_dXnxKhEjFYjFBcyNmE4gglm-h4MqsLaW9b5uYMYhHDT9mYTcUKAesv3Gn81bEnBSv9rR-GZczsrS_vXO1L9QmvglRGi3vSJ4Win-2vVDyC0DjP8hyJ8Vsh5d6K30JIwxxTkJodkkcstqC0G3FRbCxu0RZYhnOT1ZQcRfc2OP4kSTvorqyI9fGUd1iWrv3R-BUA-xDsUH0jET47H5Ma1eEzsqcINDnCzrXB9g7SAUQ7reahuX9EKPT4bBZNyhg0yphCssbgEECpz4BAFE4z912U3dM9vfTkL80rVG6pOISqSsdiy5pXhQ3nnoCPFMFJgKZBOxuq9jrKpAH7s0THUXRAdMwbR94yfJzw6JFlzeNxQUsj8FYuxq1Zgw4VQ9ir3Mrd0u&p=0&fvj=1&vjs=3
"Revenue Manager, AR/VR",Facebook,"Menlo Park, CA","skills:  
Partner with product and engineering teams to understand new business models, and design and implement scalable finance operational processes and systems to support the business. 
Review revenue contracts to ensure compliance with GAAP (ASC 606) and internal policies. 
Document technical accounting positions on significant multiple element revenue arrangements. 
Own month end close procedures for the AR/VR business including preparation and review of journal entries, reconciliations, and other duties as necessary. 
Streamline and improve existing finance systems and processes to enable the business and finance function to scale. 
Fulfillment of internal and external audit requests. 
Partner with Sales and Marketing teams to operationalize and implement various marketing initiatives. 
Partner with cross-functional teams to research customer queries/issues and coordinate timely resolution. 
CPA 
Bachelor’s degree in Accounting, Finance or related field 
Proficient with ASC 606 and experience with implementing of such accounting guidance 
Experience with implementing SOX 404 as well as on-going documentation 
8+ years of experience in Finance/Accounting 
Knowledge of U.S. GAAP and Internal Controls 
Project management and systems implementation experience 
Experience with Microsoft Excel and PowerPoint 
Big 4/public company experience 
Experience working with Core Engineering and Payments Engineering and E-Commerce teams 
Experience in the global retail and hardware industry 
Experience with ASC 606 (Multiple Element Arrangement) accounting implementation 
Experience with Oracle ERP Hiring Lab Career Advice Browse Jobs Browse Companies Salaries Find Certifications Employer Events Work at Indeed Countries About Help Center Do Not Sell My Personal Information Privacy Center",https://www.indeed.com//rc/clk?jk=33a8a89a65bba720&fccid=1639254ea84748b5&vjs=3
AR/VR Finance Project Manager,Facebook,"Menlo Park, CA","skills:  
Manage large-scale finance systems implementation projects (Oracle, Essbase, Hive, Tableau). 
Gather business requirements from across the finance Org and project manage engineering team to build finance solutions. 
Communicate technical issues with business partners and business needs to technical partners. 
Create automated reporting for P&L and headcount forecasting. 
Drive process improvements by partnering with up-stream process owners and enhance current tools/systems related to financial management. 
Help define and implement scalable financial processes related to month-end and quarter-end close, including accruals and reporting. 
5+ years of finance experience with an emphasis on financial systems and databases 
Experience with SQL, Tableau, Oracle, Essbase 
Experience in P&L forecasting, budgeting, & FP&A concepts 
Experience working and solving problems independently, organizing workload and priorities, and completing tasks on time 
Experience partnering with and influencing key functional leaders 
Experience in applicable accounting concepts and financial planning 
Bachelor's degree 
Experience supporting Hardware development organizations Hiring Lab Career Advice Browse Jobs Browse Companies Salaries Find Certifications Employer Events Work at Indeed Countries About Help Center Do Not Sell My Personal Information Privacy Center",https://www.indeed.com//rc/clk?jk=1b90507641f2299e&fccid=1639254ea84748b5&vjs=3
