Title,Company,Location,JD,URL
"Director, Product, AR/VR Growth",Facebook,"Menlo Park, CA","skills:  
Establish shared vision across the company by building consensus on Growth strategy and priorities leading to product execution. 
Understand how to prioritize highest impact opportunities based on analysis, product strategy, and technical development. 
Drive product development with a team of world-class engineers, designers, and data scientists. 
Integrate design thinking, strategic metrics design, and rigour hypothesis driven experimentation to maximize impact on growth trajectories. 
Maximize efficiency in a constantly evolving environment where the process is fluid and creative solutions are the norm. 
10+ years of experience in product management, product data science, or engineering for software products and technologies. 
Proven track record in optimizing user acquisition channels, conversion funnels, and monetization. 
Experience in user psychology, and a track-record of using these insights to create great user experiences that also accomplish business results. 
Experience leading with intuition but validating through data-driven experimentation and user research. 
Experience collaborating with research, design, engineering, and analytics to drive growth initiatives. Hiring Lab Career Advice Browse Jobs Browse Companies Salaries Find Certifications Employer Events Work at Indeed Countries About Help Center Do Not Sell My Personal Information Privacy Center",https://www.indeed.com//rc/clk?jk=3e8e48419c90e32e&fccid=1639254ea84748b5&vjs=3
"Website Marketing Manager, AR/VR Marketing",Facebook,"Menlo Park, CA","skills:  
Define and implement web content and design strategy and execution to ensure SEO, funnel, UX and conversion best practices 
Spearhead site strategy, information architecture, content, themes, and overall design of the website with internal stakeholders, cross-functional teams, and external agency partners 
Partner with other channel leads across social, email and paid media to drive growth through end-to-end campaign optimization, A/B testing and localization 
Generate analytical insights to inform optimal consumer experience, drive conversion improvement, CPA efficiencies and traffic growth 
Brainstorm new and creative growth strategies 
Identify opportunities for technical and platform improvement, quantify impact and drive tool/platform improvements with product and technical teams 
BA/BS degree 
8+ years of consumer marketing experience in a fast-paced environment 
Knowledge of digital marketing, website design and management, content strategy 
Experience in planning digital marketing strategies and developing solutions to attract and convert website traffic 
Experience working and building relationships with cross-functional groups 
Communication skills, analytical experience, and creative problem-solving 
Team-oriented to work effectively across all levels of management, teams, and disciplines 
Experience in a fast-paced, always-on, startup environment 
MBA or other relevant advanced degree preferred 
Experience in consumer technology 
Working knowledge of HTML, JS, CSS Hiring Lab Career Advice Browse Jobs Browse Companies Salaries Find Certifications Employer Events Work at Indeed Countries About Help Center Do Not Sell My Personal Information Privacy Center",https://www.indeed.com//rc/clk?jk=f86075ff7f6e01af&fccid=1639254ea84748b5&vjs=3
"QA Lead, AR/VR",Facebook,"Menlo Park, CA","skills:  
Build a test-driven engineering culture that drives improvements in quality. 
Implement process changes to scale testing efforts across multiple products. 
Test functionality of games and apps built for Oculus ecosystem. 
Plan, develop and execute test coverage for multiple platforms. 
Diagnose issues, report defects, and propose regression tests to discover reoccurrences. 
Work with engineers and project leads to triage and prioritize issues for resolution. 
Own the process of creating metrics to measure and monitor product performance. 
Partner with Automation and Infrastructure team to leverage automation to allow better reliability and scalability. 
BS/MS in Computer Science or equivalent experience. 
Experience debugging applications on Platform, PC and Mobile component. 
Experience building, shipping, and maintaining commercial software. 
Experience coding in Python, PHP, Java, C/C++ or equivalent language. 
Experience in managing black box and white box testing. Hiring Lab Career Advice Browse Jobs Browse Companies Salaries Find Certifications Employer Events Work at Indeed Countries About Help Center Do Not Sell My Personal Information Privacy Center",https://www.indeed.com//rc/clk?jk=4997347414542732&fccid=1639254ea84748b5&vjs=3
"Director, Engineering, AR/VR Experiences",Facebook,"Menlo Park, CA","skills:  
Manage grow and mentor a team of Managers and Tech Leads. Define organizational culture and technical strategy for Horizon Engineering team. 
Establish and teach sustainable engineering practices to ensure Horizon becomes a successful Product as a Service. 
Establish effective collaboration with engineering teams inside Social Experiences, AR/VR and across Facebook. 
Build a culture of seamless cross-discipline collaboration between Engineering, Product, Art, Design, Data Science and User Research. 
Work with Technical Program Management to develop effective Operating Model and process for the Horizon team. 
Offer organizational design thinking to best structure the team and equip them for success in their goals. 
Leading Software as a Service products with >1M peak concurrent users. 
12+ years of experience Developing and leading teams in the field of real time software. 
10+ years of management experience with direct reports under your guidance and leadership. 
5+ years of experience managing, mentoring and growing senior leaders (managers of managers). 
Shipping Interactive real time experiences at scale. 
Experience in platform/ecosystem products, marketplaces. 
BA/BS in Computer Science or related field. Hiring Lab Career Advice Browse Jobs Browse Companies Salaries Find Certifications Employer Events Work at Indeed Countries About Help Center Do Not Sell My Personal Information Privacy Center",https://www.indeed.com//rc/clk?jk=00d54146aeaffb46&fccid=1639254ea84748b5&vjs=3
"Product Experience Quality Engineer, AR/VR Accessories",Facebook,"Menlo Park, CA","skills:  
Create process and procedures to consistently track project test plans, testing progress, and open issues. 
Run regular bug/issue review meetings for each product in development. 
Coordinate a post-sales support plan for each product. 
Coordinate and contribute to engineering deliverables including specifications and test plans. 
Develop processes for out-of-the-box experience testing. 
Perform product/experience regression testing for new builds. 
Ensure program test documents are complete, current and available for staff and leadership review. 
Work cross-functionally to develop best practices and quality/test processes to support internal and external teams in developing Oculus products and Oculus certified products. 
Influence product manufacturability, testability, serviceability, reliability, flexibility and cost effectiveness. 
3+ years of Quality Engineering experience related to consumer electronics products. 
A history of shipping reliable products that customers love. 
Demonstrated technical skills and experience, including a detailed understanding of Final Assembly, Test, Pack and SMT processes. 
Knowledge with program and issue tracking and version control software. 
Experience leveraging third party vendors for extended test. 
Experience operating in dynamic, fast-paced environment with minimal supervision. 
Knowledge for AR/VR and video conferencing technologies. 
Experience with packaging. 
Software testing experience (black-box user experience). 
Experience with IMUs/sensor physical sensor systems with an understanding of calibration/test methods. 
Experience with testing vision systems. 
Experience with PC, USB, Bluetooth, or Wifi logo testing. 
Experience taking products through certifications such as UL, CE, FCC, IC, or ETL. 
Experience with audio performance testing. 
Experience with soft goods and mechanical assemblies. 
Experience with GD&T & tolerance analysis. 
Experience with wearable products that require bio-compatibility testing and compliance. Hiring Lab Career Advice Browse Jobs Browse Companies Salaries Find Certifications Employer Events Work at Indeed Countries About Help Center Do Not Sell My Personal Information Privacy Center",https://www.indeed.com//rc/clk?jk=9e8d28b2beb78367&fccid=1639254ea84748b5&vjs=3
"Software Development Engineer in Test, AR/VR",Facebook,"Menlo Park, CA","skills:  
Create and implement high-quality automated tests to verify release readiness 
Design and implement automated test frameworks and tools to fill test gaps 
Investigate automated test failures to ensure high signal from our automated tests 
Manage contingent engineers on the team to ensure high output volume 
Track effectiveness and coverage of automated tests 
Partner with infrastructure and feature engineering teams to ensure automation is fully enabled 
Independently drive goals as a project manager - tracking and reporting on status, escalating risks, and finding solutions to obstacles 
Evangelize and drive a culture of quality within Facebook AR/VR by advocating for high quality, quickly escalating issues found by automation or blocking test execution, and helping other teams understand the importance of testing 
BS/MS in Computer Science or equivalent experience 
Experience debugging software and/or hardware 
Python, JavaScript, PHP or Java or C/C++ or equivalent language 
Experience with black box or white box testing 
Experience designing and building automation lab infrastructure 
Experience designing and building automated test frameworks 
Experience with QA strategy development and execution 
Experience reporting progress and results to stakeholders Hiring Lab Career Advice Browse Jobs Browse Companies Salaries Find Certifications Employer Events Work at Indeed Countries About Help Center Do Not Sell My Personal Information Privacy Center",https://www.indeed.com//rc/clk?jk=216ef58693a78b42&fccid=1639254ea84748b5&vjs=3
"Manager, Channel Operations - AR/VR",Facebook,"Menlo Park, CA","skills:  
Build, mentor, and grow the North America channels operations team 
Partnering closely with North America Sales team to support and enable market growth and customer satisfaction 
Drives operational capability initiatives in support of process efficiency and adding value for Partners 
Support and measure operational KPI’s and generate related reporting to improve performance 
Support the allocation process and align with cross-functional partners in sales and supply planning 
Continually support and improve the overall Collaborative Planning Forecasting and Replenishment processes 
Ensure timely B2B RMA receiving within Partner and 3PL SLA’s and overall compliance 
Align with key internal/external partners to improve the overall order to cash process 
Active participation in Sales & Operations meetings and forum 
Ensure internal and SOX compliance for order management processes 
Back-up for Channel Operations Analysts that are traveling on leave or on PTO 
Willingness and ability to travel up to 10% to domestic and international locations 
8+ years of direct people management experience and managing the order management (order to cash) function for hardware products supporting Retail and Enterprise customers 
Experience with on-boarding new partners, products, and markets 
Experience managing or major contributor for CPFR processes 
Proven track record of getting things done (projects, initiatives, process improvements, etc.) 
Proven experience influencing all levels within the organization 
Proven communication skills 
Experience using Oracle, SAP, or another major ERP platform 
Experience working in a fast paced, dynamic environment with changing priorities and deadlines 
Bachelor’s degree Hiring Lab Career Advice Browse Jobs Browse Companies Salaries Find Certifications Employer Events Work at Indeed Countries About Help Center Do Not Sell My Personal Information Privacy Center",https://www.indeed.com//rc/clk?jk=177b2dbc44c2e9d0&fccid=1639254ea84748b5&vjs=3
AR/VR Electrical Engineer,Facebook,"Menlo Park, CA","skills:  
Transform vendor reference designs, or block diagrams into custom solutions 
Design, implement, debug and characterize embedded systems with end-to-end ownership of EE product design from concept to launch 
Design schematics, complete board layouts, assembly, test, debug, and integrate designs into opto electro-mechanical systems 
Optimize architecture and circuits for power consumption and battery life 
Collaborate closely with cross-functional teams such industrial design, architecture, product design, NPI, and supply chain 
Work closely with CM/JDM resources to leverage their engineers and maximize the focus of internal resources on adding value to and differentiating our product 
Drive the resolution of technical issues by working with the cross-functional teams: Electrical, Mechanical, SW, Quality, Reliability as well as the various CM/JDM teams 
Perform lab measurements, and factory tests as needed to validate the design and resolve any issues 
Track test progress, bugs, and fixes and produce regular progress reports
 
Bachelors in Electrical Engineering or related fields or equivalent experience 
Experience in consumer electronics or related fields 
Experience in embedded or mobile system design, hardware architecture, board design, board bring-up and product NPI experience 
Experience and knowledge of printed circuit board (PCB) technologies, such as rigid, flex, hybrid, HDI, etc. 
Experience leading technical teams, cross-functional groups and vendors against plans
 
Masters in Electrical Engineering or related fields or equivalent experience 
5+ years of experience in consumer electronics or related fields 
5+ years of experience in embedded or mobile system design, hardware architecture, board design, board bring-up and product NPI experience 
Demonstrated experience bringing new technologies to product 
Experience performing bench level power measurements to validate battery life 
Knowledge of the relationship between physical layout and electrical performance 
Experience running signal integrity simulations Hiring Lab Career Advice Browse Jobs Browse Companies Salaries Find Certifications Employer Events Work at Indeed Countries About Help Center Do Not Sell My Personal Information Privacy Center",https://www.indeed.com//rc/clk?jk=c3d649fa77219721&fccid=1639254ea84748b5&vjs=3
AR/VR Business Analyst,Tailored Management,"Menlo Park, CA","skills:  Consolidate third-party retailer sales reports and upload reports to Hive Metastore. Use SQL to query sales related data on a distributed system. Create reports and dashboards to support sales leadership in making effective, analytically driven, and strategic decisions. Explore new data sources to add signal to existing models and develop models for new sales opportunities. Perform ad-hoc and in-depth analyses and then reporting/presenting insights. Partner with regional heads of sales to develop regional sales strategy. 2+ years of experience in business reporting, business intelligence or sales analytics. Reporting experience in a consumer electronics environment or retail industry preferred. Experience in querying and manipulating raw datasets for analysis using SQL (Presto, Spark, Hive). Experience in data ETL preferred. Experience in visualization, dashboards and reporting using Tableau, or other BI tools. Ability to partner with cross functional teams, prioritize tasks and move fast on projects. Experience in communicating findings to both technical and non-technical audiences. BS/MS degree in a quantitative discipline: statistics, applied mathematics, business analytics, computer science, engineering, economics, etc. Bachelor's (Required) United States (Required) One location Health insurance Dental insurance Vision insurance Monday to Friday Day shift 8 hour shift Hiring Lab Career Advice Browse Jobs Browse Companies Salaries Find Certifications Employer Events Work at Indeed Countries About Help Center Do Not Sell My Personal Information Privacy Center",https://www.indeed.com//pagead/clk?mo=r&ad=-6NYlbfkN0DI_pqscLjs9LkB0jlO39g2s8RE9SCHTdataN4HV1TulGfWI13h5d2IIBkrMCBpdyoKFuk6LoRw93nv9VIf-nwycaiTnbsKlxaYmP2oUVCrEos5MOIWzflKyJqtBexCiKWVxNVq0D9Lo3YRyX8n959AonagBpNTwfxL-PurTe6VIuRucl5-GiO9Z3AHltrL2IwrFwRD-3xtJmg5lOjTHAkhBpxE1J_CcTLbbzW-kmhhsFhy_y34muJXoemeT3iU7t1Kj_i9d8C_EgKJjZYGudxsS3MVTF0JCs4eQ7zSyDxj1ADOH0BU6dov5OOMG2ec7U4eL8QPnqx5tuJabChQjcVFyBPlQgC2YdOECXIjxf3udz-sel1g_KI5sqB9XiU1NtSwyeYTcH9TxGAUe5x56NliQ1QgtsVoELcPCw3BY3dpXgm76qED3NHeCRk60VsySCp1tZRinPMSxm0xDIdYi_O9&p=11&fvj=1&vjs=3
AR/VR Product Design Engineer,Facebook,"Menlo Park, CA","skills:  
End-to-end ownership of full product and/or module architecture from concept through launch. 
Collaborate with program management, industrial design, user experience, component module, and supply chain teams. 
Drive road map for next-generation materials, manufacturing processes, and/or mechanism design. 
Leverage overseas teams (ODM/JDM/CM) to maximize the focus of our internal resources on adding value and differentiation to our products. 
Establish and refine product design process, best practices, and/ or tools for the organization. 
Bachelors or equivalent experience in Mechanical Engineering or related fields 
Experience in consumer electronics or related fields 
Experience in mobile and/or wearable mechanical product design, mechanical system architecture, prototype validation, and new product introduction (NPI) 
Experience leading technical teams, cross-functional groups, and overseas manufacturers 
Demonstrated experience in plastic and metal part design 
Experience in Design for Manufacturability (DFM), Design for Assembly (DFA), statistical tolerance analysis techniques, functional dimensioning, geometric tolerancing, and 3D/2D CAD 
Masters in Mechanical Engineering or related fields 
Experience with integrating component modules (AMOLED displays, batteries, camera modules, etc.), interconnect (FPC design and ACF bonding), and/or Integration of wireless antenna (GSM, GPS, Wifi, LTE) into mechanical enclosures 
5+ years of experience in consumer electronics or related fields 
5+ years of experience in mobile and/or wearable mechanical product design, mechanical system architecture, prototype validation, and new product introduction (NPI) 
Experience in NX/Teamcenter Hiring Lab Career Advice Browse Jobs Browse Companies Salaries Find Certifications Employer Events Work at Indeed Countries About Help Center Do Not Sell My Personal Information Privacy Center",https://www.indeed.com//rc/clk?jk=2f8cd58b636376ee&fccid=1639254ea84748b5&vjs=3
"Associate General Counsel, AR/VR",Facebook,"Menlo Park, CA","skills:  
Analyze products, policies, and initiatives to develop strategy for future products and provide practical legal risk mitigation strategies across multiple jurisdictions 
Provide legal support to teams developing innovative solutions to safety, integrity, and accessibility issues in new technologies and contexts 
Work closely with business leads in related functions at Facebook, including UX researchers, perceptual scientists, product managers, engineers, designers, and policy teams 
Provide legal advice to product, software engineering and other business teams across many subject areas, including consumer protection, privacy, integrity, and accessibility regulations 
Analyze products, policies, and initiatives to develop strategy for future products and provide practical legal risk mitigation strategies across multiple jurisdictions 
Build positive and influential relationships with executives, product teams, and peers across the AR/VR organization 
Lead consensus building and drive coordination with other members of the legal team and teams within the business 
J.D. degree and membership in at least one U.S. state bar 
8+ years combined law firm and in-house experience, including experience working with technology companies 
Experience counseling clients on legal issues relating to consumer protection laws, data privacy/privacy laws, accessibility laws, and general products liability concerns 
Experience working on international consumer product safety matters 
Experience counseling clients on legal issues relating to cybercrimes, law enforcement requests and online safety measures Hiring Lab Career Advice Browse Jobs Browse Companies Salaries Find Certifications Employer Events Work at Indeed Countries About Help Center Do Not Sell My Personal Information Privacy Center",https://www.indeed.com//rc/clk?jk=3959e3db7855b417&fccid=1639254ea84748b5&vjs=3
"Manager, Display Strategic Sourcing - AR/VR",Facebook,"Menlo Park, CA","skills:  
Develop overall vision, strategy and execution plan for the Global Display module Sourcing function. Driving an integrated long-term supplier development approach focused on delivering world class quality, delivery and cost. 
Negotiate and execute master supply contracts and other critical agreements including but not limited to licensing agreements, SOWs, etc. 
Establish, manage and own strategic supplier relationships at the supplier executive level. 
Develop, manage and refresh individual and customized Display technology, Architecture and commodity sourcing strategies for each actively managed technology. 
Lead Supplier QBR process focused on exceeding Facebook KPI’s and continuous performance improvement. 
Analyze, develop and implement supplier capacity and custom Display “should cost” model. 
Develop deep technical and commercial relationships with executive management at suppliers. 
Influence supplier technology roadmaps and create internal disruptive value-add to ensure Facebook’s system architecture and commercial requirements are met. 
Work in partnership with the various engineering teams to develop an approved and qualified supply base, develop strategic partnerships that address our needs and, on an ongoing basis, continuously improve supplier performance. 
Partner with cross-functional teams (i.e., PM, engineering, quality, ID, PD, logistics, etc.) to continuously improve overall system-level landed cost and identify strategic trends in Facebook’s design practices that will have an impact on procurement. 
Influence engineering and architecture teams for NPI development strategy and implementation, optimizing design/materials/process selection to drive lowest cost, industry leading quality, and continuity of predictable supply. 
Lead Total Cost Reduction program to ensure the lowest possible total cost, including product cost, transportation cost, inventory cost, and cost of quality. 
Develop commodity supplier sourcing strategy ensuring the supplier is capable of meeting Facebook’s current and future technical and business requirements. 
Drive Early Supplier Involvement initiatives to ensure our suppliers are proactively providing input into new product designs and future product roadmaps. 
10+ years of sourcing and procurement experience in Display and/or Electronics Commodity and technology management, including demonstrated experience managing overall supplier performance. 
Engineering or Technical BS degree. 
Experience working in enterprises with hardware portfolio. 
Expertise in market analysis to dissect market size, players, customers, growth, technology replacements/forecasts, pricing trends, etc., to formulate sourcing strategies. 
Expertise in financial statement analysis to derive should-cost models and cost competitiveness/financial strengths of suppliers, as well as gathering market intelligence. 
Advanced Engineering degree and/or MBA. Hiring Lab Career Advice Browse Jobs Browse Companies Salaries Find Certifications Employer Events Work at Indeed Countries About Help Center Do Not Sell My Personal Information Privacy Center",https://www.indeed.com//rc/clk?jk=3bfe4e1694cd4777&fccid=1639254ea84748b5&vjs=3
"Product Policy Manager, AR/VR and Devices",Facebook,"Menlo Park, CA","skills:  
Evaluate and provide policy guidance on new products and features 
Work with software developers, designers, lawyers, product managers, and others to help interdisciplinary teams address policy, legal, engineering, user interface, business, marketing and other privacy requirements 
Help Facebook regarding product policy issues, including in external meetings and at conferences 
Help articulate policy philosophy, launches, and changes to relevant parties, including management, operations, and other internal and external stakeholders 
Build out and manage a small team 
Bachelor's degree in public policy, legal, political science or related field 
7+ years of work experience in public policy, policy enforcement, or product design with a focus on Trust and Safety issues 
Experience with data analytics and problem-solving 
Experience with consensus-building in a highly matrixed environment 
JD, MPP, MBA, or technical degree 
Experience in Internet/social media/media content issues, AR/VR, or internet enabled devices 
Experience legislative frameworks 
Experience with messaging, telecommunications, gaming, or mobile applications Hiring Lab Career Advice Browse Jobs Browse Companies Salaries Find Certifications Employer Events Work at Indeed Countries About Help Center Do Not Sell My Personal Information Privacy Center",https://www.indeed.com//rc/clk?jk=f368a40605f974ad&fccid=1639254ea84748b5&vjs=3
